{
  "order": 255,
  "slug": "FROM_RUIN_TO_REDEMPTION_THE_QUESTION_THAT_SAVES",
  "title": "From Ruin to Redemption: The Question that Saves",
  "summary": "Acts 16 gives us one of Scripture’s most stunning portraits of salvation: the conversion of the Philippian jailer. This man was no spiritual seeker—he was a hardened Roman officer, defined by authority, discipline, and the power of the empire. His identity depended on maintaining control, for Roman law demanded his life if a prisoner escaped. Yet in one divinely orchestrated moment, everything he relied on collapsed.\n\nPaul and Silas had been beaten and imprisoned for delivering a slave girl from a spirit of divination, disrupting her masters’ income. In the darkest part of the prison, instead of despair, they prayed and sang praises—an act of spiritual defiance and faith. At midnight, God responded with a violent earthquake that shook the foundations, opened every door, and broke every chain. The jailer, assuming escape and fearing execution, prepared to take his own life. But Paul’s cry—“Do thyself no harm, for we are all here”—stopped him. This act of mercy broke him in a way no earthquake could.\n\nOverwhelmed, he fell before Paul and Silas and asked the most important question any human soul can ask: “What must I do to be saved?” His fear of temporal ruin became the doorway to eternal redemption. Paul’s answer was simple and profound: “Believe on the Lord Jesus Christ, and thou shalt be saved, and thy house.” Salvation required not works, rituals, or punishment—only faith.\n\nThe jailer’s transformation was immediate. The man who once guarded wounds now washed them. The oppressor became a servant. He and his household were baptized, and joy filled his home. His story mirrors our own: God often shakes the foundations of our lives so we will finally look upward and ask the saving question. And the answer remains unchanged—believe in the Lord Jesus Christ.",
  "pdfLink": "/sermons/FROM_RUIN_TO_REDEMPTION_THE_QUESTION_THAT_SAVES.pdf",
  "image": "/sermons/FROM_RUIN_TO_REDEMPTION_THE_QUESTION_THAT_SAVES.png",
  "imgRef": "https://chatgpt.com/s/m_693defca8cb48191a01959deb97b6ea8",
  "pages": 4,
  "date": null
}