{
  "order": 274,
  "slug": "THE_TREASURE_OF_THE_UNREAD_LETTER",
  "title": "The Treasure of the Unread Letter",
  "summary": "This sermon, “The Treasure of the Unread Letter,” teaches that God’s plan for a person’s life is already written, even when circumstances feel confusing, painful, or directionless. Using Jeremiah 29:11, the message emphasizes that God is not improvising—His intentions are already established, even if they are not yet visible to us.\n\nThrough biblical examples, the sermon shows how people lived without understanding their situation, yet were still inside God’s plan. Joseph endured betrayal, slavery, and prison, not realizing these were steps toward leadership. Ruth experienced loss and poverty, unaware she was part of a lineage leading to Christ. Paul struggled with a persistent “thorn,” which preserved his dependence on God. Esther’s unlikely rise to queen positioned her to save her people at the right moment.\n\nIn each case, their reality felt uncertain, but God’s purpose was already in motion. The central message is that what looks like delay, loss, or confusion is often part of a larger design that cannot yet be seen.\n\nThe sermon concludes by urging believers to remain faithful in ordinary life, even without understanding. Rather than panicking over unanswered questions, they are called to trust the one who “wrote the letter.” The future is not random or forgotten—it is intentionally prepared. The “unread letter” represents a future already known by God, waiting to be revealed at the right time.",
  "pdfLink": "/sermons/THE_TREASURE_OF_THE_UNREAD_LETTER.pdf",
  "image": "/sermons/THE_TREASURE_OF_THE_UNREAD_LETTER.png",
  "imgRef": "https://unsplash.com/photos/red-rose-on-white-envelope-yOwNK2LzSZI",
  "pages": 4,
  "date": "2026-05-04"
}