{
  "order": 199,
  "slug": "THE_ROCK_AND_THE_PIT",
  "title": "The Rock and the Pit",
  "summary": "This sermon, based on Isaiah 51:1, emphasizes the dual reflection on both the rock from which believers are hewn and the pit from which they were rescued. Isaiah prophesied during a turbulent period in Judah's history, calling the people back to God amidst political instability and spiritual decline. The sermon focuses on the identity of born-again believers, who are described as being cut from the rock—Jesus Christ. Christ is the foundation and the strength of salvation, unshakeable and immovable, providing security and hope. Like Peter, who was a small stone cut from the massive rock of Jesus, believers are reminded of their divine origin and the immovable nature of their faith.\nThe sermon further recalls Moses' failure to speak to the rock, instead striking it, symbolizing that believers must not command God but pray and seek Him with humility. When discouraged, like Elijah, we must look to the rock for strength to continue the fight. The rock also symbolizes the ultimate victory, as Jesus will return to destroy the kingdom of the Antichrist.\nAt the same time, believers are reminded to look back at the pit from which they were saved. This pit symbolizes sin, shame, and despair, from which God mercifully rescues humanity, much like Joseph was lifted from the pit by Midianites. By recognizing both the security of the rock and the depth of the pit, believers stay grounded in gratitude and humility. The stories of David and Peter illustrate how God rescues us from our failures, restoring us through grace. By keeping both perspectives in mind, believers maintain their walk on the path of salvation.",
  "pdfLink": "/sermons/THE_ROCK_AND_THE_PIT.pdf",
  "image": "/sermons/THE_ROCK_AND_THE_PIT.png",
  "imgRef": "https://www.tekportal.net/wp-content/uploads/2018/11/pit.jpg",
  "pages": "3",
  "date": null
}