{
  "order": 202,
  "slug": "JESUS_THE_MEANING_OF_LIFE",
  "title": "Jesus: the Meaning of Life",
  "summary": "This sermon explores the search for the meaning of life and how it ultimately leads to Jesus Christ. It begins with the idea that, throughout our lives, we look for meaning in people and relationships, such as with parents or friends. However, these sources, though significant, fall short and fail to provide lasting fulfillment. This continual search points to a deeper need for purpose beyond human connections.\n\nThe sermon asserts that true life originates from God. In Acts 17:28, Paul states, \"In him we live, and move, and have our being,\" emphasizing that all life exists within God, even if many remain unaware of this truth. Humanity’s existence in God is made possible by the breath of life He gives. Yet, due to sin, humans lost their connection to the true meaning of life, leading to a sense of separation from God and spiritual emptiness.\n\nJesus Christ came to bridge this gap. Through His birth, life, death, and resurrection, Jesus restored humanity’s access to the meaning of life. He declared, “I am the way, the truth, and the life” (John 14:6), indicating that only through Him can one reconnect with God. To partake in this restored life, individuals must accept Jesus, symbolically eating His flesh and drinking His blood, representing a deep, transformative union with Him.\n\nIn conclusion, discovering the meaning of life involves two revelations: understanding that we live within God and recognizing that true life is found in Jesus Christ. By believing in Jesus, being baptized in His name, and receiving the Holy Spirit, one can fully experience life’s purpose. This sermon invites believers to embrace this truth not just intellectually but through a personal, spiritual encounter with Jesus.\n    ",
  "pdfLink": "/sermons/JESUS_THE_MEANING_OF_LIFE.pdf",
  "image": "/sermons/JESUS_THE_MEANING_OF_LIFE.png",
  "imgRef": "https://unsplash.com/photos/another-new-image-link",
  "pages": 2,
  "date": null
}