{
  "order": 250,
  "slug": "EBEDMELECH_FAITH_BEYOND_BORDERS",
  "title": "Ebed-melech: Faith Beyond Borders",
  "summary": "The story of Ebed-Melech, the Ethiopian eunuch in Jeremiah 38, reveals a powerful truth about faith that transcends race, nationality, and social status. His name means “Servant of the King,” yet his actions proved he was truly a servant of the King of Heaven. As a black man in Israel and a foreigner in Judah’s royal court, Ebed-Melech could have remained silent, unseen, and uninvolved. Instead, when Jeremiah the prophet was thrown into a dungeon and left to die, he courageously approached King Zedekiah and pleaded for the prophet’s life. His compassion moved him to act when others were paralyzed by fear. At great personal risk, Ebed-Melech rescued Jeremiah with ropes and rags, embodying both humility and holy boldness. His faith was not limited by culture or privilege—it was anchored in his trust in God’s justice and truth. Remarkably, while Judah’s own leaders rejected Jeremiah’s message, it was an African who believed and defended God’s prophet. For his faith, God promised deliverance: “I will surely deliver thee... because thou hast put thy trust in me, saith the LORD” (Jer. 39:18). Ebed-Melech’s story reminds us that faith is not bound by borders; it belongs to all who trust in God’s word and stand for righteousness. His courage foreshadowed the faith of another Ethiopian—the eunuch in Acts 8—who received the gospel through Philip and carried it back to Africa, proving that God’s salvation extends to every nation. Ebed-Melech stands as a timeless witness that God honors those who believe His prophets, defend truth, and act with courage when others fall silent. In a world divided by race and fear, his faith challenges us to stand boldly for righteousness, to lift up the oppressed, and to remember that God’s saving grace knows no boundaries.",
  "pdfLink": "/sermons/EBEDMELECH_FAITH_BEYOND_BORDERS.pdf",
  "image": "/sermons/EBEDMELECH_FAITH_BEYOND_BORDERS.png",
  "imgRef": "https://chatgpt.com/s/m_68fdefdf9afc81919dc04e389ab511ae",
  "pages": 4,
  "date": null
}