{
  "order": 175,
  "slug": "THE_PURPOSE_OF_FASTING",
  "title": "The Purpose of Fasting",
  "summary": "The sermon delves into the significance of fasting, drawing primarily from Deuteronomy 8:3, which highlights that God humbled Israel through hunger, introducing the concept of fasting as a means of subordinating the desires of the flesh to appreciate God. The origin of pride is linked to a corrupt spirit, fueled by the flesh and its reliance on food.\n\nThe narrative refers to the Israelites, who, after 430 years of slavery in Egypt, expected a lavish feast on their journey to the promised land. However, God, testing their ability to prioritize spiritual needs over physical desires, provided manna. The kingdom of God, the sermon emphasizes, is not about meat and drink but righteousness, peace, and joy in the Holy Ghost.\n\nThe war between the flesh, craving earthly comforts, and the spirit, yearning for God, is explored. Fasting is portrayed as a practice that trains the flesh to submit to the spirit. The sermon links the Lord's forty-day fast to this war, emphasizing that Jesus, not having a flesh from the earth, was not subject to earthly cravings.\n\nThe act of fasting is presented as a declaration that the earth will not be the master but Jesus, the God of the Spirit. Quoting John 8:23-24, the distinction between being from beneath (earthly) and from above (spiritual) is highlighted. The death of Judas is cited as a cautionary example of prioritizing the stomach (earthly) over spiritual matters.\n\nThe scripture in Deuteronomy 8:3 is dissected further, emphasizing that man lives not by bread alone but by every word that proceeds out of the mouth of the Lord. Fasting is portrayed as a demonstration of awareness of our origin, created by the word of God. The act of fasting, the sermon contends, signifies spiritual maturity and investment in a better spiritual tomorrow.\n\nThe sermon concludes by referencing Mark 2:19-20, where Jesus speaks about fasting in the context of the bridegroom being taken away. This is interpreted as a recognition that, in the absence of the direct presence of the divine (the bridegroom), fasting becomes a crucial spiritual discipline.",
  "pdfLink": "/sermons/THE_PURPOSE_OF_FASTING.pdf",
  "image": "/sermons/THE_PURPOSE_OF_FASTING.jpeg",
  "imgRef": "https://images.squarespace-cdn.com/content/v1/601093fd30ef2d697a10ecba/1633040367277-U658QCE8CYD2J79Q66JP/fasting-prayer-jesus.jpg",
  "pages": "2",
  "date": null
}