{
  "order": 224,
  "slug": "MORDECHAI_A_BEACON_OF_VIGILANCE_AND_FAITHFULNESS",
  "title": "Mordechai: a Beacon of Vigilance and Faithfulness",
  "summary": "The story of Mordechai in the Book of Esther highlights themes of vigilance, courage, and divine providence. As a descendant of Kish, a Benjaminite, Mordechai’s heritage connects him to King Saul, signifying a legacy shaped by destiny. Though living in exile, he remained steadfast in his Jewish faith, demonstrating wisdom, integrity, and compassion—especially toward Esther.\n\nMordechai’s vigilance was proactive, as seen when he uncovered a plot to assassinate King Ahasuerus (Esther 2:21-23). His actions reflect spiritual readiness and a commitment to justice, paralleling the Christian call to be watchful in prayer (1 Peter 5:8). His refusal to bow to Haman was an act of faith and defiance against an Amalekite enemy, echoing Ephesians 6:13’s command to stand firm in the face of opposition.\n\nGod’s divine reversal is evident when Haman, who sought Mordechai’s downfall, was instead forced to honor him (Esther 6:7-11). This mirrors God’s justice seen in the lives of Joseph and Daniel, showing that humility leads to exaltation (Proverbs 18:12). Eventually, Mordechai rose to power, using his influence to advocate for his people (Esther 10:3), embodying the call to seek justice and peace (Isaiah 58:6-7).\n\nMordechai’s story challenges us to be vigilant, faithful, and courageous amid adversity. Just as he stood firm at the king’s gate, we are called to stand for righteousness in our communities. Even when we face trials, God’s providence is at work, reminding us that faithfulness leads to divine favor. As Romans 8:31 affirms, “If God be for us, who can be against us?” May we follow Mordechai’s example, trusting in God’s plan and standing firm in our faith. Amen.",
  "pdfLink": "/sermons/MORDECHAI_A_BEACON_OF_VIGILANCE_AND_FAITHFULNESS.pdf",
  "image": "/sermons/MORDECHAI_A_BEACON_OF_VIGILANCE_AND_FAITHFULNESS.png",
  "imgRef": "https://www.google.com/url?sa=i&url=https%3A%2F%2Fwww.adamhuntlaw.com%2Fhow-ohios-stand-your-ground-law-affects-criminal-defense%2F&psig=AOvVaw3EijaxU0ltgM9dnM3MdUPh&ust=1742771586031000&source=images&cd=vfe&opi=89978449&ved=0CBQQjRxqFwoTCNCC2a3onowDFQAAAAAdAAAAABAE",
  "pages": 3,
  "date": null
}