{
  "order": 203,
  "slug": "FOUND_BY_HIM_THE_UNSEEN_SEEKERS_OF_CHRIST",
  "title": "Found By Him: the Unseen Seekers of Christ",
  "summary": "This sermon explores the theme of God’s initiative in reaching individuals, often those who aren't actively seeking Him. Isaiah 65:1 and Romans 10:20 highlight the mystery of divine grace, where God reveals Himself even to those who aren't looking for Him. Through four biblical narratives, the sermon emphasizes how God’s compassion and sovereignty extend to the most unexpected people.\n\nFirst, the story of Saul, son of Kish (1 Samuel 9) illustrates how God uses ordinary events for divine purposes. Saul’s search for his father’s lost donkeys leads him to be anointed as Israel’s first king, showing that God can redirect mundane pursuits into encounters with destiny.\n\nSecond, in Luke 7, Jesus encounters a funeral procession in Nain, where He raises a widow’s only son from the dead. This act of compassion occurs without the widow seeking Him, demonstrating prevenient grace—God’s mercy and intervention before humans even recognize their need.\n\nThe third story, Zacchaeus the tax collector (Luke 19), shows a man seeking Jesus out of curiosity rather than faith. Jesus calls Zacchaeus down from a sycamore tree, enters his home, and offers salvation, symbolizing divine hospitality and acceptance. This story underscores that even our smallest steps toward God can lead to profound transformation.\n\nLastly, Saul of Tarsus (Acts 9) actively persecutes Christians, yet encounters Jesus on the road to Damascus. This dramatic conversion highlights God’s irresistible grace, capable of transforming even the most resistant heart. Saul’s transformation into Paul, a devoted apostle, reflects the boundless reach of God’s mission.\n\nIn these stories, we see a unifying theme of God’s grace reaching the unexpected. Hebrews 11:6 encourages those who diligently seek Him, assuring that they will encounter His rewards. The sermon concludes by urging believers to seek God wholeheartedly, trusting in His unfailing presence and promises.",
  "pdfLink": "/sermons/FOUND_BY_HIM_THE_UNSEEN_SEEKERS_OF_CHRIST.pdf",
  "image": "/sermons/FOUND_BY_HIM_THE_UNSEEN_SEEKERS_OF_CHRIST.png",
  "imgRef": "https://unsplash.com/photos/another-new-image-link",
  "pages": 3,
  "date": null
}