{
  "order": 243,
  "slug": "THE_WATERS_OF_SALVATION_A_JOURNEY_THROUGH_RIGHTEOUSNESS_AND_GRACE",
  "title": "The Waters of Salvation: a Journey Through Righteousness and Grace",
  "summary": "The Scriptures use water as a powerful symbol of judgment, cleansing, and salvation. In the story of Noah, the Flood reveals both God’s wrath against sin and His mercy in preserving the righteous. Though the waters destroyed a corrupt world, they also lifted the ark, carrying Noah and his family safely to a new beginning. The journey had no human sailor or fixed destination—God Himself was the navigator, reminding us that salvation rests not in human effort but in divine providence. When the ark rested on Mount Ararat, Noah and his family stepped into a silent, renewed world with no enemies to harm them, only God’s promise of a new beginning. Their arrival foreshadows the believer’s inheritance in Christ—a divine reset that delivers us from the corruption of sin into the liberty of God’s children.\n\nThe sacrifices of Abel and Noah illustrate the link between faith, righteousness, and salvation. Abel’s offering of blood symbolized atonement and pointed forward to Christ’s sacrifice, while Noah’s offering after the Flood expressed gratitude and worship for divine deliverance. Together, they reveal that faith and obedience unlock divine favor. Water becomes the medium of transition—what once threatened destruction also became the agent of renewal, washing away the old to make way for God’s new creation.\n\nUnlike Adam, whose disobedience led him into a strange land of separation, Noah’s obedience and righteousness brought him into a new land of blessing. His faith in God’s promise demonstrates that trust and righteousness are the keys to divine salvation. For us today, the lesson is clear: the waters of life may be turbulent, but when God is the sailor, they carry us not to ruin but to renewal. Through faith and obedience, we are guided by His hand into the promised land of salvation.",
  "pdfLink": "/sermons/THE_WATERS_OF_SALVATION_A_JOURNEY_THROUGH_RIGHTEOUSNESS_AND_GRACE.pdf",
  "image": "/sermons/THE_WATERS_OF_SALVATION_A_JOURNEY_THROUGH_RIGHTEOUSNESS_AND_GRACE.png",
  "imgRef": "https://videos.openai.com/vg-assets/assets%2Ftask_01k3dnk5zjff9ag38cq9gs3eqp%2F1756026809_img_0.webp?st=2025-08-24T08%3A02%3A19Z&se=2025-08-30T09%3A02%3A19Z&sks=b&skt=2025-08-24T08%3A02%3A19Z&ske=2025-08-30T09%3A02%3A19Z&sktid=a48cca56-e6da-484e-a814-9c849652bcb3&skoid=aa5ddad1-c91a-4f0a-9aca-e20682cc8969&skv=2019-02-02&sv=2018-11-09&sr=b&sp=r&spr=https%2Chttp&sig=Eo61ylNskOvpmn1vSHFvsGd7exofkGI42SOM5gseu48%3D&az=oaivgprodscus",
  "pages": 4,
  "date": null
}