{
  "order": 195,
  "slug": "POWER_FROM_ON_HIGH",
  "title": "Power from on High",
  "summary": "The sermon discusses the essential role of the Holy Spirit in the lives of believers, as depicted in Acts 1:8, where Jesus promises His disciples power through the Holy Spirit. The disciples, despite their faith, gifts, and three years of learning directly from Jesus, required the Holy Spirit to fulfill their mission. Their “graduation” on the Day of Pentecost marked the beginning of their true spiritual empowerment. The sermon highlights the importance of waiting on God's timing, as seen in biblical figures like Abraham, Joseph, and Moses, who all waited years for God's promises to be fulfilled. The apostles' ten-day wait in the Upper Room for the Holy Spirit was a test of their patience and faith. The Holy Spirit's arrival on Pentecost, symbolized by the rushing wind and tongues of fire, signified God’s eagerness to empower His followers and fulfill His purposes through them. The filling of the Holy Spirit is likened to a harvest, where believers, like crops, are finally gathered and made wholly His. The sermon emphasizes that without the Holy Spirit, we cannot realize our full potential in God. The transformation of Peter from a fearful, impetuous man to a bold apostle is cited as an example of the Spirit’s power. The sermon concludes by underscoring the global impact of Pentecost, as the anointing of diverse languages enabled the spread of the Gospel. To receive this power, believers must recognize Jesus as Lord and Savior, repent of their sins, and be baptized in His name, following the path outlined in Acts 2:38. The sermon ends with a prayerful hope that the “tongues of fire” of the Holy Spirit may rest upon all who seek God’s salvation.",
  "pdfLink": "/sermons/POWER_FROM_ON_HIGH.pdf",
  "image": "/sermons/POWER_FROM_ON_HIGH.png",
  "imgRef": "https://unsplash.com/photos/flame-illustration-XOQJa4OC8P0",
  "pages": "3",
  "date": null
}