{
  "order": 161,
  "slug": "THE_CROWNS_OF_VICTORY_A_CHRISTIANS_ETERNAL_REWARD",
  "title": "The Crowns of Victory a Christian's Eternal Reward",
  "summary": "This sermon explores the profound significance of crowns in the Scriptures, beginning with an examination of five Hebrew words for crown in the Old Testament: Qodhqodh, Zer, Nezer, Atarah, and Kether. Each word reveals layers of meaning, symbolizing honor, authority, dedication, victory, and regal majesty. The exploration emphasizes that crowns in the Old Testament represent not only positions of authority but also symbols of consecration, victory, and regal honor.\n\nTransitioning to the New Testament, the sermon delves into the promises of the five crowns awaiting faithful Christians. The Greek term \"Stephanos,\" akin to the wreaths awarded in ancient competitions, is described as representing victory and triumph. The five crowns—Soul Winners Crown, Crown of Self-Denial, Crown of Righteousness, Crown of Life, and Crown of the Under Shepherd—each hold a unique promise, reflecting aspects of service, discipline, righteousness, endurance, and shepherding.\n\nThe Soul Winners Crown, mentioned in 1 Thessalonians 2:19, is portrayed as a source of hope, joy, and rejoicing, symbolizing the victory of bringing souls into the presence of the Lord at His coming. The Crown of Self-Denial, found in 1 Corinthians 9:25, is associated with mastery and victory, emphasizing the incorruptible reward for practicing self-discipline for the sake of Christ.\n\nThe Crown of Righteousness, as per 2 Timothy 4:8, symbolizes the wreath of victory worn by those excelling in righteousness, promising eternal honor from the righteous Judge to those eagerly awaiting His return. The Crown of Life, described in James 1:12, represents triumph over trials and challenges, a testament to the endurance and faithfulness of believers in the face of life's hardships.\n\nFinally, the Crown of the Under Shepherd, mentioned in 1 Peter 5:4, symbolizes the crown of glory that awaits faithful shepherds in God's flock. As believers serve under the chief Shepherd, Jesus Christ, they are promised a crown that does not fade away, signifying eternal honor and glory.\n\nThe sermon concludes with a call to strive for these imperishable crowns with hearts full of love, service, endurance, and faithfulness, understanding that they are the eternal rewards from the chief Shepherd, Jesus Christ.",
  "pdfLink": "/sermons/THE_CROWNS_OF_VICTORY_A_CHRISTIANS_ETERNAL_REWARD.pdf",
  "image": "/sermons/THE_CROWNS_OF_VICTORY_A_CHRISTIANS_ETERNAL_REWARD.png",
  "imgRef": "https://unsplash.com/photos/a-gold-crown-with-black-and-white-stones--6nDec_KT7U",
  "pages": "4",
  "date": null
}