{
  "order": 235,
  "slug": "EMBRACING_THE_DIVINE_MANDATE_TO_SHARE_CHRIST",
  "title": "Embracing the Divine Mandate to Share Christ",
  "summary": "This sermon explores the divine mandate given in Matthew 28:19, emphasizing that sharing Christ is not a suggestion but a central calling for every believer. Evangelism is a lifestyle rooted in our relationship with Jesus, expressed through four interconnected pillars: speaking about Christ, living out the Gospel, praying for others, and discipling new believers. Personal testimony plays a crucial role in witnessing. Like the Apostle Paul, whose dramatic transformation became the foundation of his evangelism, and the Samaritan woman, who joyfully shared her encounter with Jesus, believers are called to tell their own stories with humility and authenticity. Real-life transformation resonates more than rehearsed presentations. Equally essential is living a life that reflects Christ’s love and character. Our actions—kindness, integrity, sacrifice, and compassion—are daily sermons that confirm the message we speak. The early church modeled this powerfully in Acts, drawing others to Christ through unity and generosity. Prayer, often overlooked, is the spiritual foundation of evangelism. As seen in Cornelius’ story and the prayers of the early church, intercession prepares hearts, invites divine encounters, and fuels the believer’s endurance and love. Without prayer, evangelism becomes mere effort; with it, it becomes Spirit-empowered mission. The final pillar is discipleship—walking with new believers beyond conversion. Jesus' command includes teaching them to obey all He taught, ensuring they grow into mature, rooted followers. Paul’s ministry was marked by this commitment, as he taught, mentored, and supported young believers through trials. Discipleship requires patience, authenticity, and presence. Altogether, these four pillars—talking, living, praying, and shepherding—form a holistic, Spirit-led witness that glorifies God and advances His kingdom. Evangelism is not an occasional act but a daily expression of love, obedience, and partnership with God in His redemptive plan for the world. We are all called to embrace it faithfully.",
  "pdfLink": "/sermons/EMBRACING_THE_DIVINE_MANDATE_TO_SHARE_CHRIST.pdf",
  "image": "/sermons/EMBRACING_THE_DIVINE_MANDATE_TO_SHARE_CHRIST.png",
  "imgRef": "https://unsplash.com/photos/green-plant-x8ZStukS2PM",
  "pages": 5,
  "date": null
}